### ISSUE TITLE
ClusterIP Network Policies Cannot Match Selectors From Nodes in New Node Pool Subnet

### ISSUE THREAD

**Issue by Kerushi** [Azure/AKS#2449]
### **What happened**:

Network Policies unexpectedly broke existing traffic flows after creating two subnets (userpool & systempool) to separate out node pools.  Network calls from pods to ClusterIP services time out depending on the node the traffic originated from.

This is true for both Azure CNI with Azure Network Policies & Calico.  

**Node pools created in a different subnet than initial node pool do not properly route traffic to pods on different nodes using a ClusterIP service, resulting in valid traffic failing to match podSelectors or namespaceSelectors.**  This is best demonstrated by running tcpdump on a Target node, which shows ip masquerading is not working.

**tcpdump on target node if sender node is in different subnet (this fails because podSelector never matches, but should)**

```
tcpdump dst 172.20.0.19

02:09:03.260069 IP aks-diffsubnet-15847762-vmss000000.internal.cloudapp.net.56746 > 172.20.0.19.http: Flags [S], seq 2115708593, win 64240, options [mss 1418,sackOK,TS val 2632560766 ecr 0,nop,wscale 7], length 0
02:09:04.281909 IP aks-diffsubnet-15847762-vmss000000.internal.cloudapp.net.56746 > 172.20.0.19.http: Flags [S], seq 2115708593, win 64240, options [mss 1418,sackOK,TS val 2632561781 ecr 0,nop,wscale 7], length 0
02:09:06.291011 IP aks-diff
```

### **What you expected to happen**:

Network Policies should match namespace and pod selectors regardless of the subnet the node pool is in.  Or, AKS Clusters should not support putting node pools in separate subnets for the same cluster.

When the same call occurs from a node in the original subnet created by AKS, the flow occurs from the pod IP (not the host).  This means podSelectors and nameSpaceSelectors can successfully match in Network Policies, allowing traffic.

```
tcpdump dst 172.20.0.19

02:02:28.471100 IP 172.20.0.58.57388 > 172.20.0.19.http: Flags [S], seq 3525329808, win 64240, options [mss 1418,sackOK,TS val 3764052547 ecr 0,nop,wscale 7], length 0
02:02:28.471844 IP 172.20.0.58.57388 > 172.20.0.19.http: Flags [.], ack 402574401, win 502, options [nop,nop,TS val 3764052549 ecr 49763856], length 0
02:02:28.471888 IP 172.20.0.58.57388 > 172.20.0.19.http: Flags [P.], seq 0:72, ack 1, win 502, options [nop,nop,TS val 3764052549 ecr 49763856], length 72: HTTP: GET / HTTP/1.1
02:02:28.472096 IP 172.20.0.58.57388 > 172.20.0.19.http: Flags [.], ack 239, win 501, options [nop,nop,TS val 3764052549 ecr 49763857], length 0
02:02:28.472231 IP 172.20.0.58.57388 > 172.20.0.19.http: Flags [.], ack 851, win 501, options [nop,nop,TS val 3764052549 ecr 49763857], length 0
02:02:28.472415 IP 172.20.0.58.57388 > 172.20.0.19.http: Flags [F.], seq 72, ack 851, win 501, options [nop,nop,TS val 3764052549 ecr 49763857], length 0
02:02:28.472516 IP 172.20.0.58.57388 > 172.20.0.19.http: Flags [.], ack 852, win 501, options [nop,nop,TS val 3764052550 ecr 49763858], length 0
```

### **How to reproduce it (as minimally and precisely as possible)**:

**Create a new AKS VNET (172.20.0.0/24) with two subnets:**

```
systempool - 172.20.0.0/25
userpool - 172.20.0.128/25
```

**Create a brand new cluster with the following command, referencing above subnet:**

```
az aks create --resource-group djbaks --name djbaks --node-count 1 --network-plugin azure --service-cidr 10.0.0.0/16 --dns-service-ip 10.0.0.10 --docker-bridge-address 172.17.0.1/16 --vnet-subnet-id /subscriptions/{subscription}/resourceGroups/djbaks/providers/Microsoft.Network/virtualNetworks/djbaksk-vnet/subnets/systempool --network-policy azure --enable-aad --location eastus2 --generate-ssh-keys --attach-acr djbaks --outbound-type loadBalancer
```

** Add additional node pools in both subnets

```
az aks nodepool add \
    --resource-group djbaks \
    --cluster-name djbaks \
    --name userpool \
    --node-count 2 \
    --vnet-subnet-id /subscriptions/{subscription}/resourceGroups/djbaks/providers/Microsoft.Network/virtualNetworks/djbaksk-vnet/subnets/systempool

az aks nodepool add \
    --resource-group djbaks \
    --cluster-name djbaks \
    --name diffsubnet \
    --node-count 1 \
    --vnet-subnet-id /subscriptions/{subscription}/resourceGroups/djbaks/providers/Microsoft.Network/virtualNetworks/djbaksk-vnet/subnets/userpool
```

```
kubectl get node -o wide
NAME                                 STATUS   ROLES   AGE   VERSION    INTERNAL-IP    EXTERNAL-IP   OS-IMAGE             KERNEL-VERSION     CONTAINER-RUNTIME
aks-diffsubnet-15847762-vmss000000   Ready    agent   13m   v1.19.11   172.20.0.132   <none>        Ubuntu 18.04.5 LTS   5.4.0-1049-azure   containerd://1.4.4+azure
aks-nodepool1-15847762-vmss000000    Ready    agent   53m   v1.19.11   172.20.0.4     <none>        Ubuntu 18.04.5 LTS   5.4.0-1049-azure   containerd://1.4.4+azure
aks-userpool-15847762-vmss000000     Ready    agent   30m   v1.19.11   172.20.0.35    <none>        Ubuntu 18.04.5 LTS   5.4.0-1049-azure   containerd://1.4.4+azure
aks-userpool-15847762-vmss000001     Ready    agent   30m   v1.19.11   172.20.0.66    <none>        Ubuntu 18.04.5 LTS   5.4.0-1049-azure   containerd://1.4.4+azure
```

**I then deployed the following deployment to nodepool1 (original node pool)**

```
apiVersion: apps/v1
kind: Deployment
metadata:
  name: my-nginx
spec:
  selector:
    matchLabels:
      run: my-nginx
  replicas: 1
  template:
    metadata:
      labels:
        run: my-nginx
    spec:
      containers:
      - name: my-nginx
        image: nginx
        ports:
        - containerPort: 80
---
apiVersion: networking.k8s.io/v1
kind: NetworkPolicy
metadata:
  name: nginxtest
spec:
  podSelector:
    matchLabels:
      run: my-nginx
  policyTypes:
  - Ingress
  ingress:
  - from:
    - podSelector:
        matchLabels:
          app: djbdebian
    ports:
    - protocol: TCP
      port: 80
---
apiVersion: v1
kind: Service
metadata:
  name: my-nginx
  labels:
    run: my-nginx
spec:
  ports:
  - port: 80
    protocol: TCP
  selector:
    run: my-nginx
```

```
kubectl get pod -n nginxtest -o wide
NAME                        READY   STATUS    RESTARTS   AGE   IP             NODE                                 NOMINATED NODE   READINESS GATES
my-nginx-5b56ccd65f-89nfb   1/1     Running   0          35m   172.20.0.19    aks-nodepool1-15847762-vmss000000    <none>           <none>
```

**And ran the following commands to create a test container from each node and try calling the service:**

```
kubectl label nodes aks-userpool-15847762-vmss000001 djbtest=djbtest
kubectl -n nginxtest run -i --tty djbdebian --image=debian --restart=Never --labels app=djbdebian --overrides='{"spec": { "nodeSelector": {"djbtest": "djbtest"}}}' -- sh
apt update && apt install curl -y
curl my-nginx
```

When the djbdebian container ran on a node in the original subnet, it successfully received the response from the NGINX container.  When running the same command from a node in a different subnet, timeouts occurred.

**tcpdump on nginx node shows ip masquerading failing and selectors never match:** 

```
tcpdump dst 172.20.0.19

02:09:03.260069 IP aks-diffsubnet-15847762-vmss000000.internal.cloudapp.net.56746 > 172.20.0.19.http: Flags [S], seq 2115708593, win 64240, options [mss 1418,sackOK,TS val 2632560766 ecr 0,nop,wscale 7], length 0

```

**Anything else we need to know?**:

**Environment**:
- Kubernetes version (use `kubectl version`): 
```
Client Version: version.Info{Major:"1", Minor:"20+", GitVersion:"v1.20.4-eks-6b7464", GitCommit:"6b746440c04cb81db4426842b4ae65c3f7035e53", GitTreeState:"clean", BuildDate:"2021-03-19T19:35:50Z", GoVersion:"go1.15.8", Compiler:"gc", Platform:"linux/amd64"}
Server Version: version.Info{Major:"1", Minor:"19", GitVersion:"v1.19.11", GitCommit:"c18ff7bd5227b42c617cf371cf315d0423e91d5e", GitTreeState:"clean", BuildDate:"2021-05-25T17:38:04Z", GoVersion:"go1.15.12", Compiler:"gc", Platform:"linux/amd64"}
```

- Size of cluster (how many worker nodes are in the cluster?)
All nodes are 1.19.11
```
kubectl get node -o wide
NAME                                 STATUS   ROLES   AGE   VERSION    INTERNAL-IP    EXTERNAL-IP   OS-IMAGE             KERNEL-VERSION     CONTAINER-RUNTIME
aks-diffsubnet-15847762-vmss000000   Ready    agent   13m   v1.19.11   172.20.0.132   <none>        Ubuntu 18.04.5 LTS   5.4.0-1049-azure   containerd://1.4.4+azure
aks-nodepool1-15847762-vmss000000    Ready    agent   53m   v1.19.11   172.20.0.4     <none>        Ubuntu 18.04.5 LTS   5.4.0-1049-azure   containerd://1.4.4+azure
aks-userpool-15847762-vmss000000     Ready    agent   30m   v1.19.11   172.20.0.35    <none>        Ubuntu 18.04.5 LTS   5.4.0-1049-azure   containerd://1.4.4+azure
aks-userpool-15847762-vmss000001     Ready    agent   30m   v1.19.11   172.20.0.66    <none>        Ubuntu 18.04.5 LTS   5.4.0-1049-azure   containerd://1.4.4+azure
```

- General description of workloads in the cluster (e.g. HTTP microservices, Java app, Ruby on Rails, machine learning, etc.)
These results are from my test cluster on my personal account.  There is nothing else running in the cluster. 

- Others:

**Comment by palma21** [comment]
https://docs.microsoft.com/en-us/azure/aks/use-multiple-node-pools#add-a-node-pool-with-a-unique-subnet-preview

It is called out as not supported, but we're working on it for GA.

**Comment by palma21** [comment]
cc @paulgmiller FYI
