### ISSUE TITLE
`aks-link` sending unmasqueraded RST packets from VPN to container network

### ISSUE THREAD

**Issue by ti-mo** [Azure/AKS#2323]
On an SLA-enabled AKS cluster, we're seeing the following traffic leaving the `eth0` interface towards the container network from `aks-link` pod(s):

```
# tcpdump -i eth0
13:50:50.793900 IP 192.0.2.2.54016 > 10.240.0.35.10250: Flags [R], seq 1043206392, win 0, length 0
13:50:50.793930 IP 192.0.2.2.54016 > 10.240.0.35.10250: Flags [R], seq 1043206392, win 0, length 0
13:50:54.797229 IP 192.0.2.2.48394 > 10.240.0.4.10250: Flags [R], seq 838453926, win 0, length 0
13:50:54.797259 IP 192.0.2.2.48394 > 10.240.0.4.10250: Flags [R], seq 838453926, win 0, length 0
```

`192.0.2.x` is not routable on the container network as far I can see, looks like it's a subnet internal to the OpenVPN network joined by `aks-link`. Generally, packets are masqueraded correctly on their way out of `eth0`, but for some reason, these RSTs aren't. Any ideas?

We noticed this after a user reported these packets being dropped by Cilium since they're carrying the wrong source IP.

**What happened**: packets from 192.0.2.x sent on the container network

**What you expected to happen**: packets being masqueraded correctly out of `eth0`

**How to reproduce it (as minimally and precisely as possible)**: Deploy default AKS cluster with SLA enabled, run `tcpdump` inside an `aks-link` container.

**Anything else we need to know?**: /

**Environment**:
- Kubernetes version (use `kubectl version`): 1.18.14
- Size of cluster (how many worker nodes are in the cluster?): 2
- General description of workloads in the cluster (e.g. HTTP microservices, Java app, Ruby on Rails, machine learning, etc.) None.
- Others: None.

**Comment by ti-mo** [comment]
Hi, any chance of this getting any attention?

**Comment by phealy** [comment]
@ti-mo are you still seeing this traffic? I've tried to reproduce and not been able to.
