### ISSUE TITLE
Private Cluster API server silently closes connection

### ISSUE THREAD

**Issue by erlucier** [Azure/AKS#1877]
**What happened**: Attempts to use custom operator in private cluster to watch the cluster with long timeouts seem to lose connectivity with no connection reset being issued.

**What you expected to happen**: Connection reset be issued.

**How to reproduce it (as minimally and precisely as possible)**: Configure private cluster and use a custom operator to query the API server to watch the cluster and notice connection is silently dropped after 4 minutes.

Simple test is to run pod in private AKS cluster and exec in to its shell to run curl :

curl --no-keepalive --http1.1 -o/dev/null --cacert /run/secrets/kubernetes.io/serviceaccount/ca.crt  -H "Authorization: bearer $(cat /run/secrets/kubernetes.io/serviceaccount/token)" "https://${KUBERNETES_SERVICE_HOST}/api/v1/namespaces/default/pods?watch=1&timeoutSeconds=300"

In public cluster this connection is dropped/reset at 4 minutes but on private cluster this runs perpetually.

**Anything else we need to know?**:

**Environment**:
- Kubernetes version (use `kubectl version`):  All
- Size of cluster (how many worker nodes are in the cluster?)  N/A
- General description of workloads in the cluster (e.g. HTTP microservices, Java app, Ruby on Rails, machine learning, etc.) Custom operators
- Others: N/A
![image](https://user-images.githubusercontent.com/67287468/94278357-53e07500-ff10-11ea-9319-2b60b3ad42d7.png)

**Comment by thomasfrederikhoeck** [comment]
It is mentioned in the comments of #1052  that this is probably related.

**Comment by yangl900** [comment]
hi @erlucier @thomasfrederikhoeck 

With recent AKS release, we send RST for private cluster as well. I captured following tcpdump on my private cluster. Note the RST on `06:32:58.623539`. Please let me know if you can still repro the issue.

```
06:28:19.311916 ARP, Request who-has 10.244.1.1 tell 10.244.1.9, length 28
06:28:19.311959 ARP, Reply 10.244.1.1 is-at aa:e1:85:34:46:1c, length 28
06:28:19.311961 IP 10.244.1.9.42916 > 10.0.0.1.443: Flags [S], seq 1191664130, win 64240, options [mss 1460,sackOK,TS val 3230813412 ecr 0,nop,wscale 7], length 0
06:28:19.313580 IP 10.0.0.1.443 > 10.244.1.9.42916: Flags [S.], seq 2387092369, ack 1191664131, win 65160, options [mss 1460,sackOK,TS val 105723265 ecr 3230813412,nop,wscale 7], length 0
06:28:19.313599 IP 10.244.1.9.42916 > 10.0.0.1.443: Flags [.], ack 1, win 502, options [nop,nop,TS val 3230813413 ecr 105723265], length 0
06:28:19.316927 IP 10.244.1.9.42916 > 10.0.0.1.443: Flags [P.], seq 1:518, ack 1, win 502, options [nop,nop,TS val 3230813417 ecr 105723265], length 517
06:28:19.317792 IP 10.0.0.1.443 > 10.244.1.9.42916: Flags [.], ack 518, win 506, options [nop,nop,TS val 105723270 ecr 3230813417], length 0
06:28:19.330946 IP 10.0.0.1.443 > 10.244.1.9.42916: Flags [P.], seq 1:2476, ack 518, win 506, options [nop,nop,TS val 105723283 ecr 3230813417], length 2475
06:28:19.330952 IP 10.244.1.9.42916 > 10.0.0.1.443: Flags [.], ack 2476, win 498, options [nop,nop,TS val 3230813431 ecr 105723283], length 0
06:28:19.331610 IP 10.244.1.9.42916 > 10.0.0.1.443: Flags [P.], seq 518:612, ack 2476, win 501, options [nop,nop,TS val 3230813431 ecr 105723283], length 94
06:28:19.331908 IP 10.244.1.9.42916 > 10.0.0.1.443: Flags [P.], seq 612:2099, ack 2476, win 501, options [nop,nop,TS val 3230813432 ecr 105723283], length 1487
06:28:19.332300 IP 10.0.0.1.443 > 10.244.1.9.42916: Flags [.], ack 612, win 506, options [nop,nop,TS val 105723284 ecr 3230813431], length 0
06:28:19.332305 IP 10.0.0.1.443 > 10.244.1.9.42916: Flags [.], ack 2099, win 501, options [nop,nop,TS val 105723284 ecr 3230813432], length 0
06:28:19.332329 IP 10.0.0.1.443 > 10.244.1.9.42916: Flags [P.], seq 2476:2628, ack 2099, win 501, options [nop,nop,TS val 105723285 ecr 3230813432], length 152
06:28:19.335999 IP 10.0.0.1.443 > 10.244.1.9.42916: Flags [P.], seq 2628:2987, ack 2099, win 501, options [nop,nop,TS val 105723288 ecr 3230813432], length 359
06:28:19.336024 IP 10.244.1.9.42916 > 10.0.0.1.443: Flags [.], ack 2987, win 501, options [nop,nop,TS val 3230813436 ecr 105723285], length 0
06:32:58.623539 IP 10.0.0.1.443 > 10.244.1.9.42916: Flags [R], seq 2387095356, win 0, length 0
06:38:19.368044 IP 10.244.1.9.44044 > 10.0.0.1.443: Flags [S], seq 1103454768, win 64240, options [mss 1460,sackOK,TS val 3231413468 ecr 0,nop,wscale 7], length 0
06:38:19.369740 IP 10.0.0.1.443 > 10.244.1.9.44044: Flags [S.], seq 728095075, ack 1103454769, win 65160, options [mss 1460,sackOK,TS val 106323322 ecr 3231413468,nop,wscale 7], length 0
06:38:19.369759 IP 10.244.1.9.44044 > 10.0.0.1.443: Flags [.], ack 1, win 502, options [nop,nop,TS val 3231413469 ecr 106323322], length 0
06:38:19.370311 IP 10.244.1.9.44044 > 10.0.0.1.443: Flags [P.], seq 1:518, ack 1, win 502, options [nop,nop,TS val 3231413470 ecr 106323322], length 517
06:38:19.371251 IP 10.0.0.1.443 > 10.244.1.9.44044: Flags [.], ack 518, win 506, options [nop,nop,TS val 106323323 ecr 3231413470], length 0
06:38:19.383255 IP 10.0.0.1.443 > 10.244.1.9.44044: Flags [P.], seq 1:2476, ack 518, win 506, options [nop,nop,TS val 106323335 ecr 3231413470], length 2475
06:38:19.383261 IP 10.244.1.9.44044 > 10.0.0.1.443: Flags [.], ack 2476, win 498, options [nop,nop,TS val 3231413483 ecr 106323335], length 0
06:38:19.383861 IP 10.244.1.9.44044 > 10.0.0.1.443: Flags [P.], seq 518:612, ack 2476, win 501, options [nop,nop,TS val 3231413484 ecr 106323335], length 94
06:38:19.384165 IP 10.244.1.9.44044 > 10.0.0.1.443: Flags [P.], seq 612:2099, ack 2476, win 501, options [nop,nop,TS val 3231413484 ecr 106323335], length 1487
```

**Comment by yangl900** [comment]
I used following deployment for testing. Source code available on https://github.com/yangl900/knet

```yaml
apiVersion: rbac.authorization.k8s.io/v1
kind: Role
metadata:
  name: pod-reader
rules:
- apiGroups: [""] # "" indicates the core API group
  resources: ["configmaps"]
  verbs: ["get", "watch", "list", "update", "patch", "delete", "create"]
---
apiVersion: rbac.authorization.k8s.io/v1
kind: RoleBinding
metadata:
  name: read-pods
subjects:
# You can specify more than one "subject"
- kind: ServiceAccount
  name: default # "name" is case sensitive
  apiGroup: ""
roleRef:
  # "roleRef" specifies the binding to a Role / ClusterRole
  kind: Role #this must be Role or ClusterRole
  name: pod-reader # this must match the name of the Role or ClusterRole you wish to bind to
  apiGroup: rbac.authorization.k8s.io
---
apiVersion: apps/v1
kind: Deployment
metadata:
  name: knet-apiserver-watcher-py
spec:
  selector:
    matchLabels:
      knet: apiserver-watcher-py
  replicas: 1
  template:
    metadata:
      labels:
        knet: apiserver-watcher-py
    spec:
      containers:
        - name: watcher
          image: yangl/apiserver-watcher-py
          imagePullPolicy: Always
        - name: tcpdump
          image: corfr/tcpdump
          command:
            - "/usr/sbin/tcpdump"
            - "-i"
            - "any"
            - "-nn"
```

**Comment by thomasfrederikhoeck** [comment]
@yangl900 I can't reproduce the error anymore so I guess it is fixed 😄
